{
  "description": "The same boolean subschema projects unchanged for MCP 2026-07-28, whose Tool type accepts it.",
  "document": "documents/boolean-property-schema.json",
  "revision": "2026-07-28",
  "kind": "tool",
  "identifier": "toggle",
  "expected": {
    "name": "toggle",
    "description": "Enable or disable the feature; any value is accepted for enabled.",
    "inputSchema": {
      "type": "object",
      "properties": {
        "enabled": true
      }
    }
  }
}
