{
  "description": "A component inputSchema is resolved with its x-mcp-header kept; an array-rooted outputSchema is copied unchanged; a specification extension on an icon is omitted.",
  "document": "documents/tools.json",
  "revision": "2026-07-28",
  "kind": "tool",
  "identifier": "report",
  "expected": {
    "name": "report",
    "inputSchema": {
      "type": "object",
      "properties": {
        "region": {
          "type": "string",
          "x-mcp-header": "Region"
        }
      }
    },
    "title": "Usage report",
    "outputSchema": {
      "type": "array",
      "items": {
        "type": "number"
      }
    },
    "_meta": {
      "example.com/team": "reports"
    },
    "icons": [
      {
        "src": "https://example.com/report.png",
        "mimeType": "image/png",
        "theme": "light"
      }
    ]
  }
}
