{
  "description": "execution is copied for MCP 2025-11-25 and is not completed with defaults; tags are omitted.",
  "document": "../fixtures/expected-valid/protocol-scoped-primitives.json",
  "revision": "2025-11-25",
  "kind": "tool",
  "identifier": "run_job",
  "expected": {
    "name": "run_job",
    "inputSchema": {
      "type": "object",
      "additionalProperties": false
    },
    "execution": {
      "taskSupport": "optional"
    }
  }
}
