{
  "description": "An unscoped declaration projects to the same value in MCP 2025-03-26.",
  "document": "documents/resources-and-prompts.json",
  "revision": "2025-03-26",
  "kind": "resourceTemplate",
  "identifier": "file:///logs/{date}.log",
  "expected": {
    "uriTemplate": "file:///logs/{date}.log",
    "name": "logs",
    "description": "Daily logs.",
    "mimeType": "text/plain",
    "annotations": {
      "audience": [
        "assistant"
      ]
    }
  }
}
