{
  "description": "Resource examples are omitted.",
  "document": "../fixtures/expected-valid/named-resource-examples.json",
  "revision": "2025-11-25",
  "kind": "resource",
  "identifier": "asset:///pixel.bin",
  "expected": {
    "uri": "asset:///pixel.bin",
    "name": "pixel",
    "mimeType": "application/octet-stream",
    "size": 3
  }
}
