{
  "description": "An unscoped declaration projects to the same value in MCP 2026-07-28 as in MCP 2024-11-05.",
  "document": "documents/tools.json",
  "revision": "2026-07-28",
  "kind": "tool",
  "identifier": "search",
  "expected": {
    "name": "search",
    "description": "Search the catalog.",
    "inputSchema": {
      "type": "object",
      "properties": {
        "query": {
          "type": "string"
        }
      },
      "required": [
        "query"
      ]
    }
  }
}
