{
  "description": "Arguments keep only their PromptArgument fields, so a specification extension on an argument is omitted; an argument without required stays without it; tags and a declaration extension are omitted.",
  "document": "documents/resources-and-prompts.json",
  "revision": "2024-11-05",
  "kind": "prompt",
  "identifier": "summarize",
  "expected": {
    "name": "summarize",
    "description": "Summarize a text.",
    "arguments": [
      {
        "name": "text",
        "description": "Text to summarize.",
        "required": true
      },
      {
        "name": "style"
      }
    ]
  }
}
