{
  "description": "A component inputSchema reached through an alias and a component outputSchema are resolved; examples and elicitations are omitted.",
  "document": "../fixtures/expected-valid/reusable-components.json",
  "revision": "2026-07-28",
  "kind": "tool",
  "identifier": "search",
  "expected": {
    "name": "search",
    "inputSchema": {
      "type": "object",
      "properties": {
        "query": {
          "type": "string"
        }
      },
      "required": [
        "query"
      ],
      "additionalProperties": false
    },
    "outputSchema": {
      "type": "object",
      "properties": {
        "count": {
          "type": "integer"
        }
      },
      "required": [
        "count"
      ]
    }
  }
}
