{
  "description": "The variant scoped to MCP 2024-11-05 and 2025-03-26 is selected.",
  "document": "documents/resources-and-prompts.json",
  "revision": "2025-03-26",
  "kind": "prompt",
  "identifier": "greet",
  "expected": {
    "name": "greet",
    "arguments": [
      {
        "name": "person",
        "required": true
      }
    ]
  }
}
